{
  "name": "km",
  "format": { "pattern": "#,##0.###" },
  "proportional": { "percent": "{0}%", "perMille": "{0}‰" },
  "currency": [""],
  "scientific": "#E0",
  "compact": {
    "4digit": { "long": { "other": "0 ពាន់" }, "short": { "other": "0 ពាន់" } },
    "7digit": { "long": { "other": "0 លាន" }, "short": { "other": "0 លាន" } },
    "10digit": { "long": { "other": "0 ប៊ីលាន" }, "short": { "other": "0 ប៊ីលាន" } },
    "13digit": { "long": { "other": "0 ទ្រីលាន" }, "short": { "other": "0 ទ្រីលាន" } }
  },
  "range": {
    "between": { "short": "{0}–{1}", "long": "{0} ទៅ {1}" },
    "approximately": { "short": "~{0}", "long": "ប្រហែល {0} ដង" },
    "atLeast": { "short": "{0}+", "long": "យ៉ាងតិច {0}" },
    "atMost": { "short": "≤{0}", "long": "យ៉ាងច្រើន {0}" }
  }
}
