{
  "name": "lt",
  "format": { "pattern": "## ##0,###" },
  "proportional": { "percent": "{0} %", "perMille": "{0} ‰" },
  "currency": [""],
  "scientific": "#×10^0",
  "compact": {
    "4digit": {
      "long": { "one": "0 tūkstantis", "few": "0 tūkstančiai", "many": "0 tūkstančio", "other": "0 tūkstančių" },
      "short": { "one": "0 tūkst.", "few": "0 tūkst.", "many": "0 tūkst.", "other": "0 tūkst." }
    },
    "7digit": {
      "long": { "one": "0 milijonas", "few": "0 milijonai", "many": "0 milijono", "other": "0 milijonų" },
      "short": { "one": "0 mln.", "few": "0 mln.", "many": "0 mln.", "other": "0 mln." }
    },
    "10digit": {
      "long": { "one": "0 milijardas", "few": "0 milijardai", "many": "0 milijardo", "other": "0 milijardų" },
      "short": { "one": "0 mlrd.", "few": "0 mlrd.", "many": "0 mlrd.", "other": "0 mlrd." }
    },
    "13digit": {
      "long": { "one": "0 trilijonas", "few": "0 trilijonai", "many": "0 trilijono", "other": "0 trilijonų" },
      "short": { "one": "0 trln.", "few": "0 trln.", "many": "0 trln.", "other": "0 trln." }
    }
  },
  "range": {
    "between": { "short": "{0}–{1}", "long": "Nuo {0} iki {1}" },
    "approximately": { "short": "~{0}", "long": "maždaug {0}" },
    "atLeast": { "short": "≥{0}", "long": "bent {0}" },
    "atMost": { "short": "≤{0}", "long": "daugiausia {0}" }
  }
}
