{
  "name": "sl",
  "format": { "pattern": "#.##0,###" },
  "proportional": { "percent": "{0} %", "perMille": "{0} ‰" },
  "currency": [""],
  "scientific": "#e0",
  "compact": {
    "4digit": {
      "long": { "one": "0 tisoč", "two": "0 tisoč", "few": "0 tisoč", "other": "0 tisoč" },
      "short": { "one": "0 tis.", "two": "0 tis.", "few": "0 tis.", "other": "0 tis." }
    },
    "7digit": {
      "long": { "one": "0 milijon", "two": "0 milijona", "few": "0 milijone", "other": "0 milijonov" },
      "short": { "one": "0 mio.", "two": "0 mio.", "few": "0 mio.", "other": "0 mio." }
    },
    "10digit": {
      "long": { "one": "0 milijarda", "two": "0 milijardi", "few": "0 milijarde", "other": "0 milijard" },
      "short": { "one": "0 mrd.", "two": "0 mrd.", "few": "0 mrd.", "other": "0 mrd." }
    },
    "13digit": {
      "long": { "one": "0 bilijon", "two": "0 bilijona", "few": "0 bilijoni", "other": "0 bilijonov" },
      "short": { "one": "0 bil.", "two": "0 bil.", "few": "0 bil.", "other": "0 bil." }
    }
  },
  "range": {
    "between": { "short": "{0}–{1}", "long": "{0} do {1}" },
    "approximately": { "short": "~ {0}", "long": "okrog {0}" },
    "atLeast": { "short": "{0}+", "long": "vsaj {0}" },
    "atMost": { "short": "≤ {0}", "long": "največ {0}" }
  }
}
