{
  "name": "zh-Hant",
  "format": { "pattern": "#,##0.###" },
  "proportional": { "percent": "{0}%", "perMille": "{0}‰" },
  "currency": [""],
  "scientific": "#E0",
  "compact": {
    "5digit": { "long": { "other": "0 萬" }, "short": { "other": "0 萬" } },
    "9digit": { "long": { "other": "0 億" }, "short": { "other": "0 億" } },
    "13digit": { "long": { "other": "0兆" }, "short": { "other": "0 兆" } }
  },
  "range": {
    "between": { "short": "{0}-{1}", "long": "{0} 至 {1}" },
    "approximately": { "short": "~{0}", "long": "約 {0}" },
    "atLeast": { "short": "{0}+", "long": "最少 {0}" },
    "atMost": { "short": "≤{0}", "long": "最多 {0}" }
  }
}
