{
  "name": "it",
  "format": { "pattern": "##.##0,###" },
  "proportional": { "percent": "{0}%", "perMille": "{0}‰" },
  "currency": [""],
  "scientific": "#x10^0",
  "compact": {
    "4digit": { "long": { "one": "mille;", "other": "0 mila" } },
    "7digit": { "long": { "one": "0 milione", "other": "0 milioni" }, "short": { "one": "0 Mln", "other": "0 Mln" } },
    "10digit": {
      "long": { "one": "0 miliardo", "other": "0 miliardi" },
      "short": { "one": "0 Mrd", "other": "0 Mrd" }
    },
    "13digit": { "long": { "one": "0 bilione", "other": "0 bilioni" }, "short": { "one": "0 Bln", "other": "0 Bln" } }
  },
  "range": {
    "between": { "short": "{0}-{1}", "long": "da {0} a {1}" },
    "approximately": { "short": "~{0}", "long": "circa {0}" },
    "atLeast": { "short": "≥{0}", "long": "almeno {0}" },
    "atMost": { "short": "≤{0}", "long": "al massimo {0}" }
  }
}
