{
  "name": "ro",
  "format": { "pattern": "#.##0,###" },
  "proportional": { "percent": "{0} %", "perMille": "{0} ‰" },
  "currency": [""],
  "scientific": "#E0",
  "compact": {
    "4digit": { "long": { "one": "0 mie", "few": "0 mii", "other": "0 de mii" } },
    "7digit": {
      "long": { "one": "0 milion", "few": "0 milioane", "other": "0 de milioane" },
      "short": { "one": "0 mil.", "few": "0 mil.", "other": "0 mil." }
    },
    "10digit": {
      "long": { "one": "0 miliard", "few": "0 miliarde", "other": "0 de miliarde" },
      "short": { "one": "0 mld.", "few": "0 mld.", "other": "0 mld." }
    },
    "13digit": {
      "long": { "one": "0 trilion", "few": "0 trilioane", "other": "0 de trilioane" },
      "short": { "one": "0 tril.", "few": "0 tril.", "other": "0 tril." }
    }
  },
  "range": {
    "between": { "short": "{0} – {1}", "long": "de la {0} la {1}" },
    "approximately": { "short": "~{0}", "long": "aproximativ {0}" },
    "atLeast": { "short": "{0}+", "long": "cel puțin {0}" },
    "atMost": { "short": "≤{0}", "long": "cel mult {0}" }
  }
}
