{
  "name": "pt-PT",
  "format": { "pattern": "## ##0,###" },
  "proportional": { "percent": "{0}%", "perMille": "{0}‰" },
  "currency": [""],
  "scientific": "#E0",
  "compact": {
    "4digit": { "long": { "one": "mil;", "other": "0 mil" }, "short": { "one": "mil;", "other": "0 mil" } },
    "7digit": {
      "long": { "one": "0 milhão", "other": "0 milhões" },
      "short": { "one": "0 milhão", "other": "0 milhões" }
    },
    "10digit": {
      "long": { "one": "mil milhões;", "other": "0 mil milhões" },
      "short": { "one": "mil milhões;", "other": "0 mil milhões" }
    },
    "13digit": {
      "long": { "one": "0 bilião", "other": "0 biliões" },
      "short": { "one": "0 bilião", "other": "0 biliões" }
    }
  },
  "range": {
    "between": { "short": "{0}–{1}", "long": "{0} até {1}" },
    "approximately": { "short": "~{0}", "long": "cerca de {0}" },
    "atLeast": { "short": "Mais de {0}", "long": "pelo menos {0}" },
    "atMost": { "short": "≤{0}", "long": "no máximo {0}" }
  }
}
