{
  "name": "sw",
  "format": { "pattern": "#,##0.###" },
  "proportional": { "percent": "{0}%", "perMille": "{0}‰" },
  "currency": [""],
  "scientific": "#E0",
  "compact": {
    "4digit": {
      "long": { "one": "elfu 0;elfu -0", "other": "elfu 0;elfu -0" },
      "short": { "one": "0K", "other": "0K" }
    },
    "7digit": {
      "long": { "one": "milioni 0;milioni -0", "other": "milioni 0;milioni -0" },
      "short": { "one": "0M", "other": "0M" }
    },
    "10digit": {
      "long": { "one": "bilioni 0;bilioni -0", "other": "bilioni 0;bilioni -0" },
      "short": { "one": "0B", "other": "0B" }
    },
    "13digit": {
      "long": { "one": "trilioni 0;trilioni -0", "other": "trilioni 0;trilioni -0" },
      "short": { "one": "0T", "other": "0T" }
    }
  },
  "range": {
    "between": { "short": "{0}–{1}", "long": "{0} hadi {1}" },
    "approximately": { "short": "~{0}", "long": "takribani {0}" },
    "atLeast": { "short": "{0}+", "long": "angalau {0}" },
    "atMost": { "short": "≤{0}", "long": "hadi {0}" }
  }
}
