{
  "name": "sk",
  "format": { "pattern": "# ##0,###" },
  "proportional": { "percent": "{0} %", "perMille": "{0} ‰" },
  "currency": [""],
  "scientific": "#e0",
  "compact": {
    "4digit": {
      "long": { "one": "0 tisíc", "few": "0 tisíc", "many": "0 tisíc", "other": "0 tisíc" },
      "short": { "one": "0 tis.", "few": "0 tis.", "many": "0 tis.", "other": "0 tis." }
    },
    "7digit": {
      "long": { "one": "0 milión", "few": "0 milióny", "many": "0 miliónov", "other": "0 miliónov" },
      "short": { "one": "0 mil.", "few": "0 mil.", "many": "0 mil.", "other": "0 mil." }
    },
    "10digit": {
      "long": { "one": "0 miliarda", "few": "0 miliardy", "many": "0 miliardy", "other": "0 miliárd" },
      "short": { "one": "0 mld.", "few": "0 mld.", "many": "0 mld.", "other": "0 mld." }
    },
    "13digit": {
      "long": { "one": "0 bilión", "few": "0 bilióny", "many": "0 biliónov", "other": "0 biliónov" },
      "short": { "one": "0 bil.", "few": "0 bil.", "many": "0 bil.", "other": "0 bil." }
    }
  },
  "range": {
    "between": { "short": "{0} – {1}", "long": "{0} do {1}" },
    "approximately": { "short": "~{0}", "long": "asi {0}" },
    "atLeast": { "short": "{0}+", "long": "aspoň {0}" },
    "atMost": { "short": "≤{0}", "long": "najviac {0}" }
  }
}
