{
  "name": "pl",
  "format": { "pattern": "## ##0,###" },
  "proportional": { "percent": "{0}%", "perMille": "{0}‰" },
  "currency": [""],
  "scientific": "#E0",
  "compact": {
    "4digit": {
      "long": { "one": "0 tysiąc", "few": "0 tysiące", "many": "0 tysięcy", "other": "0 tysiąca" },
      "short": { "one": "0 tys.", "few": "0 tys.", "many": "0 tys.", "other": "0 tys." }
    },
    "7digit": {
      "long": { "one": "0 milion", "few": "0 miliony", "many": "0 milionów", "other": "0 miliona" },
      "short": { "one": "0 mln", "few": "0 mln", "many": "0 mln", "other": "0 mln" }
    },
    "10digit": {
      "long": { "one": "0 miliard", "few": "0 miliardy", "many": "0 miliardów", "other": "0 miliarda" },
      "short": { "one": "0 mld", "few": "0 mld", "many": "0 mld", "other": "0 mld" }
    },
    "13digit": {
      "long": { "one": "0 bilion", "few": "0 biliony", "many": "0 bilionów", "other": "0 biliona" },
      "short": { "one": "0 bln", "few": "0 bln", "many": "0 bln", "other": "0 bln" }
    }
  },
  "range": {
    "between": { "short": "{0}–{1}", "long": "od {0} do {1}" },
    "approximately": { "short": "~{0}", "long": "ok. {0}" },
    "atLeast": { "short": "≥{0}", "long": "co najmniej {0}" },
    "atMost": { "short": "≤{0}", "long": "co najwyżej {0}" }
  }
}
