{
  "name": "fi",
  "format": { "pattern": "# ##0,###" },
  "proportional": { "percent": "{0} %", "perMille": "{0} ‰" },
  "currency": [""],
  "scientific": "#E0",
  "compact": {
    "4digit": { "long": { "one": "0 tuhat", "other": "0 tuhatta" } },
    "7digit": {
      "long": { "one": "0 miljoona", "other": "0 miljoonaa" },
      "short": { "one": "0 milj.", "other": "0 milj." }
    },
    "10digit": {
      "long": { "one": "0 miljardi", "other": "0 miljardia" },
      "short": { "one": "0 mrd.", "other": "0 mrd." }
    },
    "13digit": {
      "long": { "one": "0 biljoona", "other": "0 biljoonaa" },
      "short": { "one": "0 bilj.", "other": "0 bilj." }
    }
  },
  "range": {
    "between": { "short": "{0}–{1}", "long": "{0} viiva {1}" },
    "approximately": { "short": "~{0}", "long": "noin {0}" },
    "atLeast": { "short": "vähintään {0}", "long": "vähintään {0}" },
    "atMost": { "short": "≤{0}", "long": "enintään {0}" }
  }
}
