{
  "name": "tr",
  "format": { "pattern": "#.##0,###" },
  "proportional": { "percent": "%{0}", "perMille": "‰{0}" },
  "currency": [""],
  "scientific": "#E0",
  "compact": {
    "4digit": { "long": { "one": "bin;", "other": "0 bin" }, "short": { "one": "0 B", "other": "0 B" } },
    "7digit": { "long": { "one": "0 milyon", "other": "0 milyon" }, "short": { "one": "0 Mn", "other": "0 Mn" } },
    "10digit": { "long": { "one": "0 milyar", "other": "0 milyar" }, "short": { "one": "0 Mr", "other": "0 Mr" } },
    "13digit": {
      "long": { "one": "0 trilyon", "other": "0 trilyon" },
      "short": { "one": "0 Trilyon", "other": "0 Trilyon" }
    }
  },
  "range": {
    "between": { "short": "{0}–{1}", "long": "{0}–{1}" },
    "approximately": { "short": "~{0}", "long": "yaklaşık {0}" },
    "atLeast": { "short": "{0}+", "long": "en az {0}" },
    "atMost": { "short": "≤{0}", "long": "en fazla {0}" }
  }
}
