{
  "name": "gu",
  "format": { "pattern": "#,##,##0.###" },
  "proportional": { "percent": "{0}%", "perMille": "{0}‰" },
  "currency": [""],
  "scientific": "[#E0]",
  "compact": {
    "4digit": { "long": { "one": "0 હજાર", "other": "0 હજાર" }, "short": { "one": "0 હજાર", "other": "0 હજાર" } },
    "6digit": { "long": { "one": "0 લાખ", "other": "0 લાખ" }, "short": { "one": "0 લાખ", "other": "0 લાખ" } },
    "8digit": { "long": { "one": "0 કરોડ", "other": "0 કરોડ" }, "short": { "one": "0 કરોડ", "other": "0 કરોડ" } },
    "10digit": { "long": { "one": "0 અબજ", "other": "0 અબજ" }, "short": { "one": "0 અબજ", "other": "0 અબજ" } },
    "12digit": {
      "long": { "one": "0 નિખર્વ", "other": "0 નિખર્વ" },
      "short": { "one": "0 નિખર્વ", "other": "0 નિખર્વ" }
    },
    "13digit": {
      "long": { "one": "0 મહાપદ્મ", "other": "0 મહાપદ્મ" },
      "short": { "one": "0 મહાપદ્મ", "other": "0 મહાપદ્મ" }
    },
    "14digit": { "long": { "one": "0 શંકુ", "other": "0 શંકુ" }, "short": { "one": "0 શંકુ", "other": "0 શંકુ" } },
    "15digit": { "long": { "one": "0 જલધિ", "other": "0 જલધિ" }, "short": { "one": "0 જલધિ", "other": "0 જલધિ" } }
  },
  "range": {
    "between": { "short": "{0}-{1}", "long": "{0} થી {1}" },
    "approximately": { "short": "~{0}", "long": "આશરે {0}" },
    "atLeast": { "short": "{0}+", "long": "ઓછામાં ઓછા {0}" },
    "atMost": { "short": "≤{0}", "long": "વધુમાં વધુ {0}" }
  }
}
