{
  "name": "hu",
  "format": { "pattern": "## ##0,###" },
  "proportional": { "percent": "{0}%", "perMille": "{0}‰" },
  "currency": [""],
  "scientific": "#E0",
  "compact": {
    "4digit": { "long": { "one": "0 ezer", "other": "0 ezer" }, "short": { "one": "0 E", "other": "0 E" } },
    "7digit": { "long": { "one": "0 millió", "other": "0 millió" }, "short": { "one": "0 M", "other": "0 M" } },
    "10digit": {
      "long": { "one": "0 milliárd", "other": "0 milliárd" },
      "short": { "one": "0 Mrd", "other": "0 Mrd" }
    },
    "13digit": { "long": { "one": "0 billió", "other": "0 billió" }, "short": { "one": "0 B", "other": "0 B" } }
  },
  "range": {
    "between": { "short": "{0} – {1}", "long": "{0} – {1}" },
    "approximately": { "short": "~{0}", "long": "kb. {0}" },
    "atLeast": { "short": "{0}+", "long": "legalább {0}" },
    "atMost": { "short": "≤{0}", "long": "legfeljebb {0}" }
  }
}
