{
  "name": "de",
  "format": { "pattern": "##.##0,###" },
  "proportional": { "percent": "{0} %", "perMille": "{0} ‰" },
  "currency": [""],
  "scientific": "#E0",
  "compact": {
    "4digit": { "long": { "one": "0 Tausend", "other": "0 Tausend" } },
    "7digit": {
      "long": { "one": "0 Million", "other": "0 Millionen" },
      "short": { "one": "0 Mio.", "other": "0 Mio." }
    },
    "10digit": {
      "long": { "one": "0 Milliarde", "other": "0 Milliarden" },
      "short": { "one": "0 Mrd.", "other": "0 Mrd." }
    },
    "13digit": {
      "long": { "one": "0 Billion", "other": "0 Billionen" },
      "short": { "one": "0 Bio.", "other": "0 Bio." }
    }
  },
  "range": {
    "between": { "short": "{0}–{1}", "long": "{0} bis {1}" },
    "approximately": { "short": "≈{0}", "long": "etwa {0}" },
    "atLeast": { "short": "{0}+", "long": "mindestens {0}" },
    "atMost": { "short": "≤{0}", "long": "höchstens {0}" }
  }
}
