{
  "name": "sw-KE",
  "format": { "pattern": "#,##0.###" },
  "proportional": { "percent": "{0}%", "perMille": "{0}‰" },
  "currency": [""],
  "scientific": "#E0",
  "compact": {
    "4digit": {
      "long": { "one": "elfu 0;elfu -0", "other": "elfu 0;elfu -0" },
      "short": { "one": "elfu 0", "other": "elfu 0" }
    },
    "7digit": { "long": { "one": "milioni 0", "other": "milioni 0" }, "short": { "one": "M0", "other": "M0" } },
    "10digit": { "long": { "one": "bilioni 0", "other": "bilioni 0" }, "short": { "one": "B0", "other": "B0" } },
    "13digit": { "long": { "one": "trilioni 0", "other": "trilioni 0" }, "short": { "one": "T0", "other": "T0" } }
  },
  "range": {
    "between": { "short": "{0}–{1}" },
    "approximately": { "short": "~{0}" },
    "atLeast": { "short": "{0}+" },
    "atMost": { "short": "≤{0}" }
  }
}
