{
  "name": "lv",
  "format": { "pattern": "## ##0,###" },
  "proportional": { "percent": "{0}%", "perMille": "{0}‰" },
  "currency": [""],
  "scientific": "#E0",
  "compact": {
    "4digit": {
      "long": { "zero": "0 tūkstošu", "one": "0 tūkstotis", "other": "0 tūkstoši" },
      "short": { "zero": "0 tūkst.", "one": "0 tūkst.", "other": "0 tūkst." }
    },
    "7digit": {
      "long": { "zero": "0 miljonu", "one": "0 miljons", "other": "0 miljoni" },
      "short": { "zero": "0 milj.", "one": "0 milj.", "other": "0 milj." }
    },
    "10digit": {
      "long": { "zero": "0 miljardu", "one": "0 miljards", "other": "0 miljardi" },
      "short": { "zero": "0 mljrd.", "one": "0 mljrd.", "other": "0 mljrd." }
    },
    "13digit": {
      "long": { "zero": "0 triljonu", "one": "0 triljons", "other": "0 triljoni" },
      "short": { "zero": "0 trilj.", "one": "0 trilj.", "other": "0 trilj." }
    }
  },
  "range": {
    "between": { "short": "{0}–{1}", "long": "no {0} līdz {1}" },
    "approximately": { "short": "~{0}", "long": "aptuveni {0}" },
    "atLeast": { "short": "≥{0}", "long": "vismaz {0}" },
    "atMost": { "short": "≤{0}", "long": "ne vairāk kā {0}" }
  }
}
